date,rating,review,year,month,weekday,final_review
2025-03-06,6,"인간 프린팅이라는 소재만 갖고도 좋은 시나리오가 됐을텐데 엄하게 토착민, 외계 생명체 사랑 넣는 바람에 시나리오가 산으로 갔음 막판 개연성이 너무 없음",2025,3,3,인간 프린팅이라는 소재만 갖고도 좋은 시나리오가 됐을텐데 엄하게 토착민 외계 생명체 사랑 넣는 바람에 시나리오가 산으로 갔음 막판 개연성이 너무 없음
2025-04-20,1,워너브라더스 1400억 손해봤다는데 진짜 애도를 표합니다.,2025,4,6,워너브라더스 억 손해봤다는데 진짜 애도를 표합니다
2025-03-12,6,어수선한 영화. 스토리에 치밀함이 부족하고 연기도 인상적이지 않다. 공포감 없는 코믹한 외계 괴물을 쓸데없이 과소비했다.,2025,3,2,어수선한 영화 스토리에 치밀함이 부족하고 연기도 인상적이지 않다 공포감 없는 코믹한 외계 괴물을 쓸데없이 과소비했다
2025-03-01,10,전 순한맛에 한 표! 그리고 봉이 계속 sf 찍어줬으면…,2025,3,5,전 순한맛에 한 표 그리고 봉이 계속 찍어줬으면
2025-03-03,8,한없이 가벼운 죽음과 비례하는 인간성,2025,3,0,한없이 가벼운 죽음과 비례하는 인간성
